{
  "schemaVersion": "1.0.0",
  "documentId": "epwiki.ko-kr.operator.5.talent-attribute",
  "semanticKey": "ko-KR|operator|5|talent-attribute",
  "locale": "ko-KR",
  "documentType": "operator_talent",
  "channel": "gameplay_facts",
  "entity": {
    "type": "operator",
    "key": "operator_5",
    "name": "아케쿠리",
    "aliases": [],
    "gameEntryId": 5
  },
  "title": "아케쿠리 — 능숙",
  "content": "아케쿠리 오퍼레이터의 능력치 재능 ‘능숙’.\n단계 1: 오퍼레이터 민첩 능력치 10 증가. 활성화 조건: 오퍼레이터 신뢰도 20% 도달, 정예화 단계 1 돌파. 재료: 프로토콜 프리즘 5개, 탈로시안 화폐 1000개.\n단계 2: 오퍼레이터 민첩 능력치 15 증가. 활성화 조건: 오퍼레이터 신뢰도 50% 도달, 정예화 단계 2 돌파. 재료: 프로토콜 프리즘 10개, 탈로시안 화폐 1800개.\n단계 3: 오퍼레이터 민첩 능력치 15 증가. 활성화 조건: 오퍼레이터 신뢰도 100% 도달, 정예화 단계 3 돌파. 재료: 프로토콜 프리즘 세트 10개, 탈로시안 화폐 6000개.\n단계 4: 오퍼레이터 민첩 능력치 20 증가. 활성화 조건: 오퍼레이터 신뢰도 100% 도달, 정예화 단계 4 돌파. 재료: 프로토콜 프리즘 세트 20개, 탈로시안 화폐 12000개.",
  "facts": {
    "kind": "attribute_talent",
    "name": "능숙",
    "stages": [
      {
        "stage": 1,
        "effect": "오퍼레이터 민첩 능력치 10 증가",
        "conditions": [
          "오퍼레이터 신뢰도 20% 도달",
          "정예화 단계 1 돌파"
        ],
        "materials": [
          {
            "id": 6,
            "code": "protocol_prism",
            "name": "프로토콜 프리즘",
            "catalogStatus": "mapped",
            "amount": 5
          },
          {
            "id": 0,
            "code": "talos_ii_currency",
            "name": "탈로시안 화폐",
            "catalogStatus": "mapped",
            "amount": 1000
          }
        ]
      },
      {
        "stage": 2,
        "effect": "오퍼레이터 민첩 능력치 15 증가",
        "conditions": [
          "오퍼레이터 신뢰도 50% 도달",
          "정예화 단계 2 돌파"
        ],
        "materials": [
          {
            "id": 6,
            "code": "protocol_prism",
            "name": "프로토콜 프리즘",
            "catalogStatus": "mapped",
            "amount": 10
          },
          {
            "id": 0,
            "code": "talos_ii_currency",
            "name": "탈로시안 화폐",
            "catalogStatus": "mapped",
            "amount": 1800
          }
        ]
      },
      {
        "stage": 3,
        "effect": "오퍼레이터 민첩 능력치 15 증가",
        "conditions": [
          "오퍼레이터 신뢰도 100% 도달",
          "정예화 단계 3 돌파"
        ],
        "materials": [
          {
            "id": 10,
            "code": "protocol_prism_set",
            "name": "프로토콜 프리즘 세트",
            "catalogStatus": "mapped",
            "amount": 10
          },
          {
            "id": 0,
            "code": "talos_ii_currency",
            "name": "탈로시안 화폐",
            "catalogStatus": "mapped",
            "amount": 6000
          }
        ]
      },
      {
        "stage": 4,
        "effect": "오퍼레이터 민첩 능력치 20 증가",
        "conditions": [
          "오퍼레이터 신뢰도 100% 도달",
          "정예화 단계 4 돌파"
        ],
        "materials": [
          {
            "id": 10,
            "code": "protocol_prism_set",
            "name": "프로토콜 프리즘 세트",
            "catalogStatus": "mapped",
            "amount": 20
          },
          {
            "id": 0,
            "code": "talos_ii_currency",
            "name": "탈로시안 화폐",
            "catalogStatus": "mapped",
            "amount": 12000
          }
        ]
      }
    ]
  },
  "filters": {
    "entityType": "operator",
    "documentType": "operator_talent",
    "groupAxis": "element",
    "groupCode": "heat",
    "groupLabel": "열기",
    "talentKind": "attribute_talent"
  },
  "provenance": {
    "normalizedRef": "data/rag/normalized/ko-KR/operator/열기/5_아케쿠리.json",
    "sourceUrl": "https://wiki.skport.com/endfield/detail?mainTypeId=1&subTypeId=1&gameEntryId=5&header=0",
    "sourceSha256": "1d32fb2a32cd175406743463d61a07b698b38b73717039f7510313cb4f8f62a0",
    "authority": "normalized_extraction",
    "verificationStatus": "rule_validated",
    "confidence": "medium",
    "evidenceDocumentIds": [
      "auto.operator_5.operator_talent.c4.w1.s4.p0.ko-kr"
    ]
  },
  "coverage": {
    "withheldFields": []
  },
  "indexing": {
    "eligible": true,
    "vector": true,
    "keyword": true,
    "structured": true,
    "contentSha256": "4e36772e6e4edfb45290cedc620fc301d25609450e435452ae3fcfa30e899854",
    "payloadSha256": "514ca663a2c3f1006de7c7a3f79bf5be14d98bb322ac432958bd3ebd6d77bc18"
  }
}
