{
  "schemaVersion": "1.0.0",
  "documentId": "epwiki.ko-kr.operator.21.talent-1",
  "semanticKey": "ko-KR|operator|21|talent-1",
  "locale": "ko-KR",
  "documentType": "operator_talent",
  "channel": "gameplay_facts",
  "entity": {
    "type": "operator",
    "key": "operator_21",
    "name": "에스텔라",
    "aliases": [],
    "gameEntryId": 21
  },
  "title": "에스텔라 — 공감",
  "content": "에스텔라 오퍼레이터의 오퍼레이터 재능 ‘공감’.\n단계 1: 매번 쇄빙 효과를 발동한 후, 다음에 사용한 배틀 스킬 서스테인이 스킬 게이지를 7.5 포인트 반환합니다. 해당 효과는 중첩되지 않습니다. 활성화 조건: 정예화 단계 1 돌파. 재료: 프로토콜 프리즘 12개, 탈로시안 화폐 2400개.\n단계 2: 매번 쇄빙 효과를 발동한 후, 다음에 사용한 배틀 스킬 서스테인이 스킬 게이지를 15 포인트 반환합니다. 해당 효과는 중첩되지 않습니다. 활성화 조건: 정예화 단계 2 돌파. 재료: 프로토콜 프리즘 40개, 탈로시안 화폐 8600개.",
  "facts": {
    "kind": "combat_talent",
    "index": 1,
    "name": "공감",
    "stages": [
      {
        "stage": 1,
        "effect": "매번 쇄빙 효과를 발동한 후, 다음에 사용한 배틀 스킬 서스테인이 스킬 게이지를 7.5 포인트 반환합니다. 해당 효과는 중첩되지 않습니다.",
        "conditions": [
          "정예화 단계 1 돌파"
        ],
        "materials": [
          {
            "id": 6,
            "code": "protocol_prism",
            "name": "프로토콜 프리즘",
            "catalogStatus": "mapped",
            "amount": 12
          },
          {
            "id": 0,
            "code": "talos_ii_currency",
            "name": "탈로시안 화폐",
            "catalogStatus": "mapped",
            "amount": 2400
          }
        ]
      },
      {
        "stage": 2,
        "effect": "매번 쇄빙 효과를 발동한 후, 다음에 사용한 배틀 스킬 서스테인이 스킬 게이지를 15 포인트 반환합니다. 해당 효과는 중첩되지 않습니다.",
        "conditions": [
          "정예화 단계 2 돌파"
        ],
        "materials": [
          {
            "id": 6,
            "code": "protocol_prism",
            "name": "프로토콜 프리즘",
            "catalogStatus": "mapped",
            "amount": 40
          },
          {
            "id": 0,
            "code": "talos_ii_currency",
            "name": "탈로시안 화폐",
            "catalogStatus": "mapped",
            "amount": 8600
          }
        ]
      }
    ]
  },
  "filters": {
    "entityType": "operator",
    "documentType": "operator_talent",
    "groupAxis": "element",
    "groupCode": "cryo",
    "groupLabel": "냉기",
    "talentKind": "combat_talent",
    "talentIndex": 1
  },
  "provenance": {
    "normalizedRef": "data/rag/normalized/ko-KR/operator/냉기/21_에스텔라.json",
    "sourceUrl": "https://wiki.skport.com/endfield/detail?mainTypeId=1&subTypeId=1&gameEntryId=21&header=0",
    "sourceSha256": "9a485770775df06fb890f4cc8819dbff38da3a85700f38380d24162763b0ab70",
    "authority": "normalized_extraction",
    "verificationStatus": "rule_validated",
    "confidence": "medium",
    "evidenceDocumentIds": [
      "auto.operator_21.operator_talent.c4.w1.s4.p0.ko-kr"
    ]
  },
  "coverage": {
    "withheldFields": []
  },
  "indexing": {
    "eligible": true,
    "vector": true,
    "keyword": true,
    "structured": true,
    "contentSha256": "1dec93e4af9bd865e6db4e7ba0475a4e248850fe73be93af39b91897d5d3895f",
    "payloadSha256": "eaabb9ba5741201265e0813573bc46b3b6042a5787395f1f09073cf637f32b32"
  }
}
