{
  "schemaVersion": "1.0.0",
  "documentId": "epwiki.ko-kr.gear.373.forging",
  "semanticKey": "ko-KR|gear|373|forging",
  "locale": "ko-KR",
  "documentType": "gear_forging",
  "channel": "gameplay_facts",
  "entity": {
    "type": "gear",
    "key": "gear_373",
    "name": "본 크러셔 머플러",
    "aliases": [],
    "gameEntryId": 373
  },
  "title": "본 크러셔 머플러 — 정밀 단조",
  "content": "본 크러셔 머플러 장비의 정밀 단조 +0부터 +3까지의 옵션 수치.\n1번 의지: +0 87, +1 95, +2 104, +3 113.\n2번 힘: +0 58, +1 63, +2 69, +3 75.\n3번 연계 스킬 피해 보너스: +0 20.7%, +1 22.8%, +2 24.8%, +3 26.9%.",
  "facts": {
    "maxLevel": 3,
    "options": [
      {
        "slot": 1,
        "name": "의지",
        "values": [
          {
            "forgeLevel": 0,
            "value": 87,
            "unit": "flat"
          },
          {
            "forgeLevel": 1,
            "value": 95,
            "unit": "flat"
          },
          {
            "forgeLevel": 2,
            "value": 104,
            "unit": "flat"
          },
          {
            "forgeLevel": 3,
            "value": 113,
            "unit": "flat"
          }
        ]
      },
      {
        "slot": 2,
        "name": "힘",
        "values": [
          {
            "forgeLevel": 0,
            "value": 58,
            "unit": "flat"
          },
          {
            "forgeLevel": 1,
            "value": 63,
            "unit": "flat"
          },
          {
            "forgeLevel": 2,
            "value": 69,
            "unit": "flat"
          },
          {
            "forgeLevel": 3,
            "value": 75,
            "unit": "flat"
          }
        ]
      },
      {
        "slot": 3,
        "name": "연계 스킬 피해 보너스",
        "values": [
          {
            "forgeLevel": 0,
            "value": 20.7,
            "unit": "percent"
          },
          {
            "forgeLevel": 1,
            "value": 22.8,
            "unit": "percent"
          },
          {
            "forgeLevel": 2,
            "value": 24.8,
            "unit": "percent"
          },
          {
            "forgeLevel": 3,
            "value": 26.9,
            "unit": "percent"
          }
        ]
      }
    ]
  },
  "filters": {
    "entityType": "gear",
    "documentType": "gear_forging",
    "groupAxis": "gearSet",
    "groupCode": "gear_set_1f8b8dc4f539",
    "groupLabel": "본 크러셔",
    "supportsForging": true
  },
  "provenance": {
    "normalizedRef": "data/rag/normalized/ko-KR/gear/본_크러셔/373_본_크러셔_머플러.json",
    "sourceUrl": "https://wiki.skport.com/endfield/detail?mainTypeId=1&subTypeId=4&gameEntryId=373&header=0",
    "sourceSha256": "d4968f63c83b720ba1265dbac6e2d46e6c6715aacbeb97b274571ea6cbd69cfe",
    "authority": "normalized_extraction",
    "verificationStatus": "rule_validated",
    "confidence": "medium",
    "evidenceDocumentIds": [
      "auto.gear_373.gear_option.c2.chapter.s2.p0.ko-kr"
    ]
  },
  "coverage": {
    "withheldFields": []
  },
  "indexing": {
    "eligible": true,
    "vector": true,
    "keyword": true,
    "structured": true,
    "contentSha256": "e38a1072942c9d62072722332e6144c4d496739c178f15f5e4fcee0c1522654a",
    "payloadSha256": "807e316cf1162ffe251d00b5360780da6349b690ea1626788d7ac9ab2ab13be1"
  }
}
