{
  "schemaVersion": "1.0.0",
  "documentId": "epwiki.ko-kr.weapon.61.option-2",
  "semanticKey": "ko-KR|weapon|61|option-2",
  "locale": "ko-KR",
  "documentType": "weapon_option",
  "channel": "gameplay_facts",
  "entity": {
    "type": "weapon",
    "key": "weapon_61",
    "name": "장대한 염원",
    "aliases": [],
    "gameEntryId": 61
  },
  "title": "장대한 염원 — 2번 옵션 공격력 증가 · 대",
  "content": "장대한 염원 무기의 2번 옵션 ‘공격력 증가 · 대’.\nRANK1: 공격력 +5.0%.\nRANK2: 공격력 +9.0%.\nRANK3: 공격력 +13.0%.\nRANK4: 공격력 +17.0%.\nRANK5: 공격력 +21.0%.\nRANK6: 공격력 +25.0%.\nRANK7: 공격력 +29.0%.\nRANK8: 공격력 +33.0%.\nRANK9: 공격력 +39.0%.",
  "facts": {
    "slot": 2,
    "name": "공격력 증가 · 대",
    "ranks": [
      {
        "rank": 1,
        "rankLabel": "RANK1",
        "metric": "공격력",
        "value": 5,
        "unit": "percent",
        "display": "+5.0%"
      },
      {
        "rank": 2,
        "rankLabel": "RANK2",
        "metric": "공격력",
        "value": 9,
        "unit": "percent",
        "display": "+9.0%"
      },
      {
        "rank": 3,
        "rankLabel": "RANK3",
        "metric": "공격력",
        "value": 13,
        "unit": "percent",
        "display": "+13.0%"
      },
      {
        "rank": 4,
        "rankLabel": "RANK4",
        "metric": "공격력",
        "value": 17,
        "unit": "percent",
        "display": "+17.0%"
      },
      {
        "rank": 5,
        "rankLabel": "RANK5",
        "metric": "공격력",
        "value": 21,
        "unit": "percent",
        "display": "+21.0%"
      },
      {
        "rank": 6,
        "rankLabel": "RANK6",
        "metric": "공격력",
        "value": 25,
        "unit": "percent",
        "display": "+25.0%"
      },
      {
        "rank": 7,
        "rankLabel": "RANK7",
        "metric": "공격력",
        "value": 29,
        "unit": "percent",
        "display": "+29.0%"
      },
      {
        "rank": 8,
        "rankLabel": "RANK8",
        "metric": "공격력",
        "value": 33,
        "unit": "percent",
        "display": "+33.0%"
      },
      {
        "rank": 9,
        "rankLabel": "RANK9",
        "metric": "공격력",
        "value": 39,
        "unit": "percent",
        "display": "+39.0%"
      }
    ]
  },
  "filters": {
    "entityType": "weapon",
    "documentType": "weapon_option",
    "groupAxis": "weaponType",
    "groupCode": "sword",
    "groupLabel": "한손검",
    "optionSlot": 2
  },
  "provenance": {
    "normalizedRef": "data/rag/normalized/ko-KR/weapon/한손검/61_장대한_염원.json",
    "sourceUrl": "https://wiki.skport.com/endfield/detail?mainTypeId=1&subTypeId=2&gameEntryId=61&header=0",
    "sourceSha256": "b3f958253600284c1eed765382c78d8df1f486fae6e7ef0cf745761e2c8abab1",
    "authority": "normalized_extraction",
    "verificationStatus": "rule_validated",
    "confidence": "medium",
    "evidenceDocumentIds": [
      "auto.weapon_61.weapon_option.c3.chapter.s3.p0.ko-kr"
    ]
  },
  "coverage": {
    "withheldFields": []
  },
  "indexing": {
    "eligible": true,
    "vector": true,
    "keyword": true,
    "structured": true,
    "contentSha256": "e6bcade8e9ae1d9f34be62465d185be48613858657516f9df604b72801d32ae3",
    "payloadSha256": "e32552f2a81aa99764ee9cff3d1f887c3b0195f1e8c5d36cbebef1306a67a86d"
  }
}
