{
  "schemaVersion": "1.0.0",
  "documentId": "epwiki.ko-kr.operator.24.infrastructure-1",
  "semanticKey": "ko-KR|operator|24|infrastructure-1",
  "locale": "ko-KR",
  "documentType": "operator_infrastructure_talent",
  "channel": "gameplay_facts",
  "entity": {
    "type": "operator",
    "key": "operator_24",
    "name": "플루라이트",
    "aliases": [],
    "gameEntryId": 24
  },
  "title": "플루라이트 — 인프라 재능 황무지의 방랑자",
  "content": "플루라이트 오퍼레이터의 인프라 재능 ‘황무지의 방랑자’.\n황무지의 방랑자 · α: 재배실에 배치 시, 광물 재료의 육성 속도 10% 증가. 활성화 조건: 정예화 단계 1 돌파. 재료: 프로토콜 프리즘 6개, 탈로시안 화폐 1600개.\n황무지의 방랑자 · β: 재배실에 배치 시, 광물 재료의 육성 속도 20% 증가. 활성화 조건: 정예화 단계 3 돌파. 재료: 프로토콜 프리즘 세트 12개, 탈로시안 화폐 8000개.",
  "facts": {
    "index": 1,
    "name": "황무지의 방랑자",
    "variants": [
      {
        "grade": "α",
        "name": "황무지의 방랑자 · α",
        "description": "재배실에 배치 시, 광물 재료의 육성 속도 10% 증가",
        "conditions": [
          "정예화 단계 1 돌파"
        ],
        "materials": [
          {
            "id": 6,
            "code": "protocol_prism",
            "name": "프로토콜 프리즘",
            "catalogStatus": "mapped",
            "amount": 6
          },
          {
            "id": 0,
            "code": "talos_ii_currency",
            "name": "탈로시안 화폐",
            "catalogStatus": "mapped",
            "amount": 1600
          }
        ]
      },
      {
        "grade": "β",
        "name": "황무지의 방랑자 · β",
        "description": "재배실에 배치 시, 광물 재료의 육성 속도 20% 증가",
        "conditions": [
          "정예화 단계 3 돌파"
        ],
        "materials": [
          {
            "id": 10,
            "code": "protocol_prism_set",
            "name": "프로토콜 프리즘 세트",
            "catalogStatus": "mapped",
            "amount": 12
          },
          {
            "id": 0,
            "code": "talos_ii_currency",
            "name": "탈로시안 화폐",
            "catalogStatus": "mapped",
            "amount": 8000
          }
        ]
      }
    ]
  },
  "filters": {
    "entityType": "operator",
    "documentType": "operator_infrastructure_talent",
    "groupAxis": "element",
    "groupCode": "nature",
    "groupLabel": "자연",
    "infrastructureTalentIndex": 1
  },
  "provenance": {
    "normalizedRef": "data/rag/normalized/ko-KR/operator/자연/24_플루라이트.json",
    "sourceUrl": "https://wiki.skport.com/endfield/detail?mainTypeId=1&subTypeId=1&gameEntryId=24&header=0",
    "sourceSha256": "949fec33735758975e7f7af4c32fb5dd785d45c95620e4a9dc4a1cfdfe682b3d",
    "authority": "normalized_extraction",
    "verificationStatus": "rule_validated",
    "confidence": "medium",
    "evidenceDocumentIds": [
      "auto.operator_24.infrastructure_talent.c4.w1.s5.p0.ko-kr"
    ]
  },
  "coverage": {
    "withheldFields": []
  },
  "indexing": {
    "eligible": true,
    "vector": true,
    "keyword": true,
    "structured": true,
    "contentSha256": "54d8cb84f841808ddcec35f793fa76ca7c91dbe0183e9375e88e0ab180855aa0",
    "payloadSha256": "5d0808f76e0b5397c794f7bf788c9d5ae9370ab17c3542f5f31e2a640ab3f21d"
  }
}
