{
  "schemaVersion": "1.0.0",
  "documentId": "epwiki.ko-kr.operator.7.talent-2",
  "semanticKey": "ko-KR|operator|7|talent-2",
  "locale": "ko-KR",
  "documentType": "operator_talent",
  "channel": "gameplay_facts",
  "entity": {
    "type": "operator",
    "key": "operator_7",
    "name": "아크라이트",
    "aliases": [],
    "gameEntryId": 7
  },
  "title": "아크라이트 — 만물의 지혜",
  "content": "아크라이트 오퍼레이터의 오퍼레이터 재능 ‘만물의 지혜’.\n단계 1: 아츠 부착 상태가 부여될 때, 30%의 확률로 해당 효과에 면역됩니다. 활성화 조건: 정예화 단계 2 돌파. 재료: 프로토콜 프리즘 48개, 탈로시안 화폐 10000개.\n단계 2: 아츠 부착 상태가 부여될 때, 50%의 확률로 해당 효과에 면역됩니다. 활성화 조건: 정예화 단계 3 돌파. 재료: 프로토콜 프리즘 세트 28개, 탈로시안 화폐 24000개.",
  "facts": {
    "kind": "combat_talent",
    "index": 2,
    "name": "만물의 지혜",
    "stages": [
      {
        "stage": 1,
        "effect": "아츠 부착 상태가 부여될 때, 30%의 확률로 해당 효과에 면역됩니다.",
        "conditions": [
          "정예화 단계 2 돌파"
        ],
        "materials": [
          {
            "id": 6,
            "code": "protocol_prism",
            "name": "프로토콜 프리즘",
            "catalogStatus": "mapped",
            "amount": 48
          },
          {
            "id": 0,
            "code": "talos_ii_currency",
            "name": "탈로시안 화폐",
            "catalogStatus": "mapped",
            "amount": 10000
          }
        ]
      },
      {
        "stage": 2,
        "effect": "아츠 부착 상태가 부여될 때, 50%의 확률로 해당 효과에 면역됩니다.",
        "conditions": [
          "정예화 단계 3 돌파"
        ],
        "materials": [
          {
            "id": 10,
            "code": "protocol_prism_set",
            "name": "프로토콜 프리즘 세트",
            "catalogStatus": "mapped",
            "amount": 28
          },
          {
            "id": 0,
            "code": "talos_ii_currency",
            "name": "탈로시안 화폐",
            "catalogStatus": "mapped",
            "amount": 24000
          }
        ]
      }
    ]
  },
  "filters": {
    "entityType": "operator",
    "documentType": "operator_talent",
    "groupAxis": "element",
    "groupCode": "electric",
    "groupLabel": "전기",
    "talentKind": "combat_talent",
    "talentIndex": 2
  },
  "provenance": {
    "normalizedRef": "data/rag/normalized/ko-KR/operator/전기/7_아크라이트.json",
    "sourceUrl": "https://wiki.skport.com/endfield/detail?mainTypeId=1&subTypeId=1&gameEntryId=7&header=0",
    "sourceSha256": "a61fdb53a82db4c9af31d9cb1edc5dcbc119e2eb074b50404b63b44b4f4caee8",
    "authority": "normalized_extraction",
    "verificationStatus": "rule_validated",
    "confidence": "medium",
    "evidenceDocumentIds": [
      "auto.operator_7.operator_talent.c4.w1.s4.p0.ko-kr"
    ]
  },
  "coverage": {
    "withheldFields": []
  },
  "indexing": {
    "eligible": true,
    "vector": true,
    "keyword": true,
    "structured": true,
    "contentSha256": "4419e42496ef8ad67187afb9640a174bcf4f29ab084c89a4ddf9d51a0069ac04",
    "payloadSha256": "7e72a484b77f9f6b5734d555b0e636112e823ff5d12c066014ffe918bbd2d7c6"
  }
}
