{
  "schemaVersion": "1.0.0",
  "documentId": "epwiki.ko-kr.weapon.64.potential",
  "semanticKey": "ko-KR|weapon|64|potential",
  "locale": "ko-KR",
  "documentType": "weapon_potential",
  "channel": "gameplay_facts",
  "entity": {
    "type": "weapon",
    "key": "weapon_64",
    "name": "기사도 정신",
    "aliases": [],
    "gameEntryId": 64
  },
  "title": "기사도 정신 — 잠재능력",
  "content": "기사도 정신 무기의 잠재능력은 마지막 옵션 ‘의료 · 침식성 광기의 불꽃’의 기본/최대 RANK를 올린다. 잠재 1는 RANK 1/4, 잠재 2는 RANK 2/5, 잠재 3는 RANK 3/6, 잠재 4는 RANK 4/7, 잠재 5는 RANK 5/8, 잠재 6는 RANK 6/9.",
  "facts": {
    "traitRef": "epwiki.ko-kr.weapon.64.option-3",
    "stages": [
      {
        "stage": 1,
        "baseRank": 1,
        "maxRank": 4,
        "effectRef": "epwiki.ko-kr.weapon.64.option-3#rank-1"
      },
      {
        "stage": 2,
        "baseRank": 2,
        "maxRank": 5,
        "effectRef": "epwiki.ko-kr.weapon.64.option-3#rank-2"
      },
      {
        "stage": 3,
        "baseRank": 3,
        "maxRank": 6,
        "effectRef": "epwiki.ko-kr.weapon.64.option-3#rank-3"
      },
      {
        "stage": 4,
        "baseRank": 4,
        "maxRank": 7,
        "effectRef": "epwiki.ko-kr.weapon.64.option-3#rank-4"
      },
      {
        "stage": 5,
        "baseRank": 5,
        "maxRank": 8,
        "effectRef": "epwiki.ko-kr.weapon.64.option-3#rank-5"
      },
      {
        "stage": 6,
        "baseRank": 6,
        "maxRank": 9,
        "effectRef": "epwiki.ko-kr.weapon.64.option-3#rank-6"
      }
    ]
  },
  "filters": {
    "entityType": "weapon",
    "documentType": "weapon_potential",
    "groupAxis": "weaponType",
    "groupCode": "arts_unit",
    "groupLabel": "아츠 유닛"
  },
  "provenance": {
    "normalizedRef": "data/rag/normalized/ko-KR/weapon/아츠_유닛/64_기사도_정신.json",
    "sourceUrl": "https://wiki.skport.com/endfield/detail?mainTypeId=1&subTypeId=2&gameEntryId=64&header=0",
    "sourceSha256": "9f898278aa145107e992969e08ec420a8961f0127945d7f3a8126db6793f6b63",
    "authority": "normalized_extraction",
    "verificationStatus": "rule_validated",
    "confidence": "medium",
    "evidenceDocumentIds": [
      "auto.weapon_64.potential.c4.chapter.s4.p0.ko-kr"
    ]
  },
  "coverage": {
    "withheldFields": []
  },
  "indexing": {
    "eligible": true,
    "vector": true,
    "keyword": true,
    "structured": true,
    "contentSha256": "54e52a99b3a2c6b4a5fd38075b650be538c1db13cb605c834b27ee5c251a641d",
    "payloadSha256": "5b7a2bbab06b38cf7e7f9612c0b0e4ea69978b06c584601df990a33458a4a7f7"
  }
}
