{
  "schemaVersion": "1.0.0",
  "documentId": "epwiki.ko-kr.operator.23.talent-2",
  "semanticKey": "ko-KR|operator|23|talent-2",
  "locale": "ko-KR",
  "documentType": "operator_talent",
  "channel": "gameplay_facts",
  "entity": {
    "type": "operator",
    "key": "operator_23",
    "name": "카치르",
    "aliases": [],
    "gameEntryId": 23
  },
  "title": "카치르 — 전장을 꿰뚫는 통찰",
  "content": "카치르 오퍼레이터의 오퍼레이터 재능 ‘전장을 꿰뚫는 통찰’.\n단계 1: 궁극기 교과서적인 맹공의 마지막 공격이 2회의 충격파를 발동하며, 충격파마다 공격력 30%의 물리 피해를 줍니다. 활성화 조건: 정예화 단계 2 돌파. 재료: 프로토콜 프리즘 48개, 탈로시안 화폐 10000개.\n단계 2: 궁극기 교과서적인 맹공의 마지막 공격이 3회의 충격파를 발동하며, 충격파마다 공격력 45%의 물리 피해를 줍니다. 활성화 조건: 정예화 단계 3 돌파. 재료: 프로토콜 프리즘 세트 28개, 탈로시안 화폐 24000개.",
  "facts": {
    "kind": "combat_talent",
    "index": 2,
    "name": "전장을 꿰뚫는 통찰",
    "stages": [
      {
        "stage": 1,
        "effect": "궁극기 교과서적인 맹공의 마지막 공격이 2회의 충격파를 발동하며, 충격파마다 공격력 30%의 물리 피해를 줍니다.",
        "conditions": [
          "정예화 단계 2 돌파"
        ],
        "materials": [
          {
            "id": 6,
            "code": "protocol_prism",
            "name": "프로토콜 프리즘",
            "catalogStatus": "mapped",
            "amount": 48
          },
          {
            "id": 0,
            "code": "talos_ii_currency",
            "name": "탈로시안 화폐",
            "catalogStatus": "mapped",
            "amount": 10000
          }
        ]
      },
      {
        "stage": 2,
        "effect": "궁극기 교과서적인 맹공의 마지막 공격이 3회의 충격파를 발동하며, 충격파마다 공격력 45%의 물리 피해를 줍니다.",
        "conditions": [
          "정예화 단계 3 돌파"
        ],
        "materials": [
          {
            "id": 10,
            "code": "protocol_prism_set",
            "name": "프로토콜 프리즘 세트",
            "catalogStatus": "mapped",
            "amount": 28
          },
          {
            "id": 0,
            "code": "talos_ii_currency",
            "name": "탈로시안 화폐",
            "catalogStatus": "mapped",
            "amount": 24000
          }
        ]
      }
    ]
  },
  "filters": {
    "entityType": "operator",
    "documentType": "operator_talent",
    "groupAxis": "element",
    "groupCode": "physical",
    "groupLabel": "물리",
    "talentKind": "combat_talent",
    "talentIndex": 2
  },
  "provenance": {
    "normalizedRef": "data/rag/normalized/ko-KR/operator/물리/23_카치르.json",
    "sourceUrl": "https://wiki.skport.com/endfield/detail?mainTypeId=1&subTypeId=1&gameEntryId=23&header=0",
    "sourceSha256": "bc0bfc7536d9836561ccdd2b8feeeba067fb28d44c332cf2d60746c0234bf642",
    "authority": "normalized_extraction",
    "verificationStatus": "rule_validated",
    "confidence": "medium",
    "evidenceDocumentIds": [
      "auto.operator_23.operator_talent.c4.w1.s4.p0.ko-kr"
    ]
  },
  "coverage": {
    "withheldFields": []
  },
  "indexing": {
    "eligible": true,
    "vector": true,
    "keyword": true,
    "structured": true,
    "contentSha256": "198541f185f96295756ddd9650efb13b8e061319af49d474a7acdcdcbc289ce8",
    "payloadSha256": "0689cc839f1d29f4a8f35ac0b78f97fe3d71f2c8372ca12dc641447a92a67ad1"
  }
}
