{
  "schemaVersion": "1.0.0",
  "documentId": "epwiki.ko-kr.operator.20.profile",
  "semanticKey": "ko-KR|operator|20|profile",
  "locale": "ko-KR",
  "documentType": "operator_profile",
  "channel": "gameplay_facts",
  "entity": {
    "type": "operator",
    "key": "operator_20",
    "name": "포그라니치니크",
    "aliases": [],
    "gameEntryId": 20
  },
  "title": "포그라니치니크 — 오퍼레이터 기본 정보",
  "content": "포그라니치니크 오퍼레이터의 기본 정보. 속성은 물리, 무기 유형은 한손검이다. 주요 능력치는 의지, 보조 능력치는 민첩이다.",
  "facts": {
    "name": "포그라니치니크",
    "element": {
      "id": 0,
      "code": "physical",
      "label": "물리"
    },
    "weaponType": {
      "id": 0,
      "code": "sword",
      "label": "한손검"
    },
    "primaryAttribute": {
      "id": 3,
      "code": "will",
      "label": "의지"
    },
    "secondaryAttribute": {
      "id": 1,
      "code": "agility",
      "label": "민첩"
    },
    "attributeCatalogOrder": [
      0,
      1,
      2,
      3
    ]
  },
  "filters": {
    "entityType": "operator",
    "documentType": "operator_profile",
    "groupAxis": "element",
    "groupCode": "physical",
    "groupLabel": "물리",
    "elementCode": "physical",
    "weaponTypeCode": "sword",
    "primaryAttributeCode": "will",
    "secondaryAttributeCode": "agility"
  },
  "provenance": {
    "normalizedRef": "data/rag/normalized/ko-KR/operator/물리/20_포그라니치니크.json",
    "sourceUrl": "https://wiki.skport.com/endfield/detail?mainTypeId=1&subTypeId=1&gameEntryId=20&header=0",
    "sourceSha256": "b9dd6b37ef97deae4fe45fa40664c8ba12ac906f7b19d5819e5bc1efe3350100",
    "authority": "normalized_extraction",
    "verificationStatus": "rule_validated",
    "confidence": "medium",
    "evidenceDocumentIds": [
      "auto.operator_20.profile.c0.chapter.s0.p0.ko-kr",
      "auto.operator_20.profile.c1.chapter.s1.p0.ko-kr"
    ]
  },
  "coverage": {
    "withheldFields": [
      {
        "path": "facts.rarity",
        "reason": "원문에서 희귀도를 텍스트로 확정할 수 없음",
        "status": "missing"
      },
      {
        "path": "facts.class",
        "reason": "클래스 이미지 매핑이 검증되지 않음",
        "status": "missing"
      },
      {
        "path": "facts.portraitUrl",
        "reason": "초상화 URL이 구조화되지 않음",
        "status": "missing"
      }
    ]
  },
  "indexing": {
    "eligible": true,
    "vector": true,
    "keyword": true,
    "structured": true,
    "contentSha256": "ee7a6407781c8f4a1b7e78304cfdb0f8e382d3f3b37514b2f02ea143758e2dfe",
    "payloadSha256": "0b746b25392100083fd16d9a73a594f069c0e9f5124ae9cd875e1e3847b0f1d4"
  }
}
