{
  "schemaVersion": "1.0.0",
  "documentId": "epwiki.ko-kr.operator.16.talent-1",
  "semanticKey": "ko-KR|operator|16|talent-1",
  "locale": "ko-KR",
  "documentType": "operator_talent",
  "channel": "gameplay_facts",
  "entity": {
    "type": "operator",
    "key": "operator_16",
    "name": "스노우샤인",
    "aliases": [],
    "gameEntryId": 16
  },
  "title": "스노우샤인 — 극지 생존",
  "content": "스노우샤인 오퍼레이터의 오퍼레이터 재능 ‘극지 생존’.\n단계 1: 생명력이 45% 이하의 목표에 치유 효과 +15%. 활성화 조건: 정예화 단계 1 돌파. 재료: 프로토콜 프리즘 12개, 탈로시안 화폐 2400개.\n단계 2: 생명력이 55% 이하의 목표에 치유 효과 +25%. 활성화 조건: 정예화 단계 2 돌파. 재료: 프로토콜 프리즘 40개, 탈로시안 화폐 8600개.",
  "facts": {
    "kind": "combat_talent",
    "index": 1,
    "name": "극지 생존",
    "stages": [
      {
        "stage": 1,
        "effect": "생명력이 45% 이하의 목표에 치유 효과 +15%",
        "conditions": [
          "정예화 단계 1 돌파"
        ],
        "materials": [
          {
            "id": 6,
            "code": "protocol_prism",
            "name": "프로토콜 프리즘",
            "catalogStatus": "mapped",
            "amount": 12
          },
          {
            "id": 0,
            "code": "talos_ii_currency",
            "name": "탈로시안 화폐",
            "catalogStatus": "mapped",
            "amount": 2400
          }
        ]
      },
      {
        "stage": 2,
        "effect": "생명력이 55% 이하의 목표에 치유 효과 +25%",
        "conditions": [
          "정예화 단계 2 돌파"
        ],
        "materials": [
          {
            "id": 6,
            "code": "protocol_prism",
            "name": "프로토콜 프리즘",
            "catalogStatus": "mapped",
            "amount": 40
          },
          {
            "id": 0,
            "code": "talos_ii_currency",
            "name": "탈로시안 화폐",
            "catalogStatus": "mapped",
            "amount": 8600
          }
        ]
      }
    ]
  },
  "filters": {
    "entityType": "operator",
    "documentType": "operator_talent",
    "groupAxis": "element",
    "groupCode": "cryo",
    "groupLabel": "냉기",
    "talentKind": "combat_talent",
    "talentIndex": 1
  },
  "provenance": {
    "normalizedRef": "data/rag/normalized/ko-KR/operator/냉기/16_스노우샤인.json",
    "sourceUrl": "https://wiki.skport.com/endfield/detail?mainTypeId=1&subTypeId=1&gameEntryId=16&header=0",
    "sourceSha256": "94bbfd165515a7620d775e1488ccf8f377db5199074ebd4092a6e1d07bf522d5",
    "authority": "normalized_extraction",
    "verificationStatus": "rule_validated",
    "confidence": "medium",
    "evidenceDocumentIds": [
      "auto.operator_16.operator_talent.c4.w1.s4.p0.ko-kr"
    ]
  },
  "coverage": {
    "withheldFields": []
  },
  "indexing": {
    "eligible": true,
    "vector": true,
    "keyword": true,
    "structured": true,
    "contentSha256": "1c27c071630584161bb3d48b31e453b35d28067358261b3eb0997d8e3f3f5fe3",
    "payloadSha256": "4c11e1b7a186c096616b1dc469819d55780acfbd15c5c4d4c883e1b7f8e9482f"
  }
}
