{
  "schemaVersion": "1.0.0",
  "documentId": "epwiki.ko-kr.gear.208.profile",
  "semanticKey": "ko-KR|gear|208|profile",
  "locale": "ko-KR",
  "documentType": "gear_profile",
  "channel": "gameplay_facts",
  "entity": {
    "type": "gear",
    "key": "gear_208",
    "name": "간편 방호복",
    "aliases": [],
    "gameEntryId": 208
  },
  "title": "간편 방호복 — 장비 기본 정보",
  "content": "간편 방호복 장비의 기본 정보. 유형은 방어구, 품질은 회색 품질, 세트는 세트 없음이다. LV.10, 방어력 8. 옵션은 1번 지능 15, 2번 의지 10, 3번 생명력 46. 정밀 단조 대상이 아니다.",
  "facts": {
    "name": "간편 방호복",
    "gearType": {
      "id": 1,
      "code": "armor",
      "label": "방어구"
    },
    "quality": {
      "id": 4,
      "code": "gray",
      "label": "회색 품질"
    },
    "gearSet": {
      "id": -1,
      "code": "none",
      "label": "세트 없음"
    },
    "level": 10,
    "defense": 8,
    "supportsForging": false,
    "options": [
      {
        "slot": 1,
        "name": "지능",
        "baseValue": {
          "value": 15,
          "unit": "flat"
        },
        "attribute": {
          "id": 2,
          "code": "intellect",
          "label": "지능"
        }
      },
      {
        "slot": 2,
        "name": "의지",
        "baseValue": {
          "value": 10,
          "unit": "flat"
        },
        "attribute": {
          "id": 3,
          "code": "will",
          "label": "의지"
        }
      },
      {
        "slot": 3,
        "name": "생명력",
        "baseValue": {
          "value": 46,
          "unit": "flat"
        }
      }
    ],
    "setEffectRef": null
  },
  "filters": {
    "entityType": "gear",
    "documentType": "gear_profile",
    "groupAxis": "gearSet",
    "groupCode": "none",
    "groupLabel": "세트 없음",
    "gearTypeCode": "armor",
    "qualityCode": "gray",
    "gearSetCode": "none"
  },
  "provenance": {
    "normalizedRef": "data/rag/normalized/ko-KR/gear/세트_없음/208_간편_방호복.json",
    "sourceUrl": "https://wiki.skport.com/endfield/detail?mainTypeId=1&subTypeId=4&gameEntryId=208&header=0",
    "sourceSha256": "ae30fed360ea80f1cc9507da1056cf7f5004a5bc4eae85bb06d25c239e31a267",
    "authority": "normalized_extraction",
    "verificationStatus": "rule_validated",
    "confidence": "medium",
    "evidenceDocumentIds": [
      "auto.gear_208.profile.c0.chapter.s0.p0.ko-kr",
      "auto.gear_208.profile.c1.chapter.s1.p0.ko-kr"
    ]
  },
  "coverage": {
    "withheldFields": []
  },
  "indexing": {
    "eligible": true,
    "vector": true,
    "keyword": true,
    "structured": true,
    "contentSha256": "e771aea2f9f6d58657c97f0f19a01a284eaf069e7876fda206b0206f572912b1",
    "payloadSha256": "07d0aace0ada0fe61640141da0f87c2093012b7dea1d17c5fced73dae1bb0d37"
  }
}
