{
  "schemaVersion": "1.0.0",
  "documentId": "epwiki.ko-kr.operator.1.infrastructure-1",
  "semanticKey": "ko-KR|operator|1|infrastructure-1",
  "locale": "ko-KR",
  "documentType": "operator_infrastructure_talent",
  "channel": "gameplay_facts",
  "entity": {
    "type": "operator",
    "key": "operator_1",
    "name": "펠리카",
    "aliases": [],
    "gameEntryId": 1
  },
  "title": "펠리카 — 인프라 재능 감독관",
  "content": "펠리카 오퍼레이터의 인프라 재능 ‘감독관’.\n감독관 · α: 핵심 제어 중추에 배치 시, 모든 오퍼레이터의 컨디션 회복 속도 8% 증가. 활성화 조건: 정예화 단계 1 돌파. 재료: 프로토콜 프리즘 6개, 탈로시안 화폐 1600개.\n감독관 · β: 핵심 제어 중추에 배치 시, 모든 오퍼레이터의 컨디션 회복 속도 12% 증가. 활성화 조건: 정예화 단계 3 돌파. 재료: 프로토콜 프리즘 세트 12개, 탈로시안 화폐 8000개.",
  "facts": {
    "index": 1,
    "name": "감독관",
    "variants": [
      {
        "grade": "α",
        "name": "감독관 · α",
        "description": "핵심 제어 중추에 배치 시, 모든 오퍼레이터의 컨디션 회복 속도 8% 증가",
        "conditions": [
          "정예화 단계 1 돌파"
        ],
        "materials": [
          {
            "id": 6,
            "code": "protocol_prism",
            "name": "프로토콜 프리즘",
            "catalogStatus": "mapped",
            "amount": 6
          },
          {
            "id": 0,
            "code": "talos_ii_currency",
            "name": "탈로시안 화폐",
            "catalogStatus": "mapped",
            "amount": 1600
          }
        ]
      },
      {
        "grade": "β",
        "name": "감독관 · β",
        "description": "핵심 제어 중추에 배치 시, 모든 오퍼레이터의 컨디션 회복 속도 12% 증가",
        "conditions": [
          "정예화 단계 3 돌파"
        ],
        "materials": [
          {
            "id": 10,
            "code": "protocol_prism_set",
            "name": "프로토콜 프리즘 세트",
            "catalogStatus": "mapped",
            "amount": 12
          },
          {
            "id": 0,
            "code": "talos_ii_currency",
            "name": "탈로시안 화폐",
            "catalogStatus": "mapped",
            "amount": 8000
          }
        ]
      }
    ]
  },
  "filters": {
    "entityType": "operator",
    "documentType": "operator_infrastructure_talent",
    "groupAxis": "element",
    "groupCode": "electric",
    "groupLabel": "전기",
    "infrastructureTalentIndex": 1
  },
  "provenance": {
    "normalizedRef": "data/rag/normalized/ko-KR/operator/전기/1_펠리카.json",
    "sourceUrl": "https://wiki.skport.com/endfield/detail?mainTypeId=1&subTypeId=1&gameEntryId=1&header=0",
    "sourceSha256": "cc4378cdc012f097bada65658318a2701132ffcbdfd22ce19c4193a8cb1308b6",
    "authority": "normalized_extraction",
    "verificationStatus": "rule_validated",
    "confidence": "medium",
    "evidenceDocumentIds": [
      "auto.operator_1.infrastructure_talent.c4.w1.s5.p0.ko-kr"
    ]
  },
  "coverage": {
    "withheldFields": []
  },
  "indexing": {
    "eligible": true,
    "vector": true,
    "keyword": true,
    "structured": true,
    "contentSha256": "ea8ca8a6670f4119b91edf22ff9a500c544fff89315a29eb2fed081ee5ec08d7",
    "payloadSha256": "e396585da65a6a0161e619c5a5c9a53472e9f2b1c3c37745eb0c1fb4ade1a290"
  }
}
