{
  "schemaVersion": "1.0.0",
  "documentId": "epwiki.ko-kr.weapon.69.option-2",
  "semanticKey": "ko-KR|weapon|69|option-2",
  "locale": "ko-KR",
  "documentType": "weapon_option",
  "channel": "gameplay_facts",
  "entity": {
    "type": "weapon",
    "key": "weapon_69",
    "name": "암흑의 횃불",
    "aliases": [],
    "gameEntryId": 69
  },
  "title": "암흑의 횃불 — 2번 옵션 열기 피해 증가 · 대",
  "content": "암흑의 횃불 무기의 2번 옵션 ‘열기 피해 증가 · 대’.\nRANK1: 열기 피해 +5.6%.\nRANK2: 열기 피해 +10.0%.\nRANK3: 열기 피해 +14.4%.\nRANK4: 열기 피해 +18.9%.\nRANK5: 열기 피해 +23.3%.\nRANK6: 열기 피해 +27.8%.\nRANK7: 열기 피해 +32.2%.\nRANK8: 열기 피해 +36.7%.\nRANK9: 열기 피해 +43.3%.",
  "facts": {
    "slot": 2,
    "name": "열기 피해 증가 · 대",
    "ranks": [
      {
        "rank": 1,
        "rankLabel": "RANK1",
        "metric": "열기 피해",
        "value": 5.6,
        "unit": "percent",
        "display": "+5.6%"
      },
      {
        "rank": 2,
        "rankLabel": "RANK2",
        "metric": "열기 피해",
        "value": 10,
        "unit": "percent",
        "display": "+10.0%"
      },
      {
        "rank": 3,
        "rankLabel": "RANK3",
        "metric": "열기 피해",
        "value": 14.4,
        "unit": "percent",
        "display": "+14.4%"
      },
      {
        "rank": 4,
        "rankLabel": "RANK4",
        "metric": "열기 피해",
        "value": 18.9,
        "unit": "percent",
        "display": "+18.9%"
      },
      {
        "rank": 5,
        "rankLabel": "RANK5",
        "metric": "열기 피해",
        "value": 23.3,
        "unit": "percent",
        "display": "+23.3%"
      },
      {
        "rank": 6,
        "rankLabel": "RANK6",
        "metric": "열기 피해",
        "value": 27.8,
        "unit": "percent",
        "display": "+27.8%"
      },
      {
        "rank": 7,
        "rankLabel": "RANK7",
        "metric": "열기 피해",
        "value": 32.2,
        "unit": "percent",
        "display": "+32.2%"
      },
      {
        "rank": 8,
        "rankLabel": "RANK8",
        "metric": "열기 피해",
        "value": 36.7,
        "unit": "percent",
        "display": "+36.7%"
      },
      {
        "rank": 9,
        "rankLabel": "RANK9",
        "metric": "열기 피해",
        "value": 43.3,
        "unit": "percent",
        "display": "+43.3%"
      }
    ]
  },
  "filters": {
    "entityType": "weapon",
    "documentType": "weapon_option",
    "groupAxis": "weaponType",
    "groupCode": "sword",
    "groupLabel": "한손검",
    "optionSlot": 2
  },
  "provenance": {
    "normalizedRef": "data/rag/normalized/ko-KR/weapon/한손검/69_암흑의_횃불.json",
    "sourceUrl": "https://wiki.skport.com/endfield/detail?mainTypeId=1&subTypeId=2&gameEntryId=69&header=0",
    "sourceSha256": "f7e90808c623b90bb744a3e6e1c362528fa7494ccb82b54dd96230343920550b",
    "authority": "normalized_extraction",
    "verificationStatus": "rule_validated",
    "confidence": "medium",
    "evidenceDocumentIds": [
      "auto.weapon_69.weapon_option.c3.chapter.s3.p0.ko-kr"
    ]
  },
  "coverage": {
    "withheldFields": []
  },
  "indexing": {
    "eligible": true,
    "vector": true,
    "keyword": true,
    "structured": true,
    "contentSha256": "20053be05b7953841aa7be52b80bf2220f96dc96273fecc704f457ea7fb46ba8",
    "payloadSha256": "90f1e0edad0f6c49c1bb22e93036b550007a67071aed8ec81b1d2cc59a9f6b4e"
  }
}
