{
  "schemaVersion": "1.0.0",
  "documentId": "epwiki.ko-kr.gear.302.forging",
  "semanticKey": "ko-KR|gear|302|forging",
  "locale": "ko-KR",
  "documentType": "gear_forging",
  "channel": "gameplay_facts",
  "entity": {
    "type": "gear",
    "key": "gear_302",
    "name": "개척자 통신기",
    "aliases": [],
    "gameEntryId": 302
  },
  "title": "개척자 통신기 — 정밀 단조",
  "content": "개척자 통신기 장비의 정밀 단조 +0부터 +3까지의 옵션 수치.\n1번 힘: +0 32, +1 35, +2 38, +3 41.\n2번 민첩: +0 21, +1 23, +2 25, +3 27.\n3번 연계 스킬 피해 보너스: +0 41.4%, +1 45.5%, +2 49.7%, +3 53.8%.",
  "facts": {
    "maxLevel": 3,
    "options": [
      {
        "slot": 1,
        "name": "힘",
        "values": [
          {
            "forgeLevel": 0,
            "value": 32,
            "unit": "flat"
          },
          {
            "forgeLevel": 1,
            "value": 35,
            "unit": "flat"
          },
          {
            "forgeLevel": 2,
            "value": 38,
            "unit": "flat"
          },
          {
            "forgeLevel": 3,
            "value": 41,
            "unit": "flat"
          }
        ]
      },
      {
        "slot": 2,
        "name": "민첩",
        "values": [
          {
            "forgeLevel": 0,
            "value": 21,
            "unit": "flat"
          },
          {
            "forgeLevel": 1,
            "value": 23,
            "unit": "flat"
          },
          {
            "forgeLevel": 2,
            "value": 25,
            "unit": "flat"
          },
          {
            "forgeLevel": 3,
            "value": 27,
            "unit": "flat"
          }
        ]
      },
      {
        "slot": 3,
        "name": "연계 스킬 피해 보너스",
        "values": [
          {
            "forgeLevel": 0,
            "value": 41.4,
            "unit": "percent"
          },
          {
            "forgeLevel": 1,
            "value": 45.5,
            "unit": "percent"
          },
          {
            "forgeLevel": 2,
            "value": 49.7,
            "unit": "percent"
          },
          {
            "forgeLevel": 3,
            "value": 53.8,
            "unit": "percent"
          }
        ]
      }
    ]
  },
  "filters": {
    "entityType": "gear",
    "documentType": "gear_forging",
    "groupAxis": "gearSet",
    "groupCode": "gear_set_443e330e6735",
    "groupLabel": "개척",
    "supportsForging": true
  },
  "provenance": {
    "normalizedRef": "data/rag/normalized/ko-KR/gear/개척/302_개척자_통신기.json",
    "sourceUrl": "https://wiki.skport.com/endfield/detail?mainTypeId=1&subTypeId=4&gameEntryId=302&header=0",
    "sourceSha256": "63d0093d27507d118ed2781cf8c77d856c50a4f11102e7dd6800d3d493d06a0b",
    "authority": "normalized_extraction",
    "verificationStatus": "rule_validated",
    "confidence": "medium",
    "evidenceDocumentIds": [
      "auto.gear_302.gear_option.c2.chapter.s2.p0.ko-kr"
    ]
  },
  "coverage": {
    "withheldFields": []
  },
  "indexing": {
    "eligible": true,
    "vector": true,
    "keyword": true,
    "structured": true,
    "contentSha256": "b845708a4e6841ba833f6d2824de6aa04c791c7a299294e290f555d663aae0f3",
    "payloadSha256": "5f8d2867b5be311fb528786420a3a6a37ac0dac7d36bcf0878f17f9ad0847b48"
  }
}
