{
  "schemaVersion": "1.0.0",
  "documentId": "epwiki.ko-kr.gear.789.forging",
  "semanticKey": "ko-KR|gear|789|forging",
  "locale": "ko-KR",
  "documentType": "gear_forging",
  "channel": "gameplay_facts",
  "entity": {
    "type": "gear",
    "key": "gear_789",
    "name": "경량 초자연 경량 보호 장갑",
    "aliases": [],
    "gameEntryId": 789
  },
  "title": "경량 초자연 경량 보호 장갑 — 정밀 단조",
  "content": "경량 초자연 경량 보호 장갑 장비의 정밀 단조 +0부터 +3까지의 옵션 수치.\n1번 의지: +0 65, +1 71, +2 78, +3 84.\n2번 민첩: +0 43, +1 47, +2 51, +3 55.\n3번 모든 스킬 피해 보너스: +0 23%, +1 25.3%, +2 27.6%, +3 29.9%.",
  "facts": {
    "maxLevel": 3,
    "options": [
      {
        "slot": 1,
        "name": "의지",
        "values": [
          {
            "forgeLevel": 0,
            "value": 65,
            "unit": "flat"
          },
          {
            "forgeLevel": 1,
            "value": 71,
            "unit": "flat"
          },
          {
            "forgeLevel": 2,
            "value": 78,
            "unit": "flat"
          },
          {
            "forgeLevel": 3,
            "value": 84,
            "unit": "flat"
          }
        ]
      },
      {
        "slot": 2,
        "name": "민첩",
        "values": [
          {
            "forgeLevel": 0,
            "value": 43,
            "unit": "flat"
          },
          {
            "forgeLevel": 1,
            "value": 47,
            "unit": "flat"
          },
          {
            "forgeLevel": 2,
            "value": 51,
            "unit": "flat"
          },
          {
            "forgeLevel": 3,
            "value": 55,
            "unit": "flat"
          }
        ]
      },
      {
        "slot": 3,
        "name": "모든 스킬 피해 보너스",
        "values": [
          {
            "forgeLevel": 0,
            "value": 23,
            "unit": "percent"
          },
          {
            "forgeLevel": 1,
            "value": 25.3,
            "unit": "percent"
          },
          {
            "forgeLevel": 2,
            "value": 27.6,
            "unit": "percent"
          },
          {
            "forgeLevel": 3,
            "value": 29.9,
            "unit": "percent"
          }
        ]
      }
    ]
  },
  "filters": {
    "entityType": "gear",
    "documentType": "gear_forging",
    "groupAxis": "gearSet",
    "groupCode": "gear_set_fb0fff599026",
    "groupLabel": "경량 초자연",
    "supportsForging": true
  },
  "provenance": {
    "normalizedRef": "data/rag/normalized/ko-KR/gear/경량_초자연/789_경량_초자연_경량_보호_장갑.json",
    "sourceUrl": "https://wiki.skport.com/endfield/detail?mainTypeId=1&subTypeId=4&gameEntryId=789&header=0",
    "sourceSha256": "505382e1f1b81a93d00ce94a80ec5ddcfcb87a99f1b22013f7c3c2f0d87aa49d",
    "authority": "normalized_extraction",
    "verificationStatus": "rule_validated",
    "confidence": "medium",
    "evidenceDocumentIds": [
      "auto.gear_789.gear_option.c2.chapter.s2.p0.ko-kr"
    ]
  },
  "coverage": {
    "withheldFields": []
  },
  "indexing": {
    "eligible": true,
    "vector": true,
    "keyword": true,
    "structured": true,
    "contentSha256": "ebe27b80f77eaf4031b83e1445414dfd004a99f875e0c3711c2a87908b0558c3",
    "payloadSha256": "6812e1ad0df834383a37a80c50fb734569acfadbf2e05fadcce8cf29162a967b"
  }
}
