{
  "schemaVersion": "1.0.0",
  "documentId": "epwiki.ko-kr.weapon.66.potential",
  "semanticKey": "ko-KR|weapon|66|potential",
  "locale": "ko-KR",
  "documentType": "weapon_potential",
  "channel": "gameplay_facts",
  "entity": {
    "type": "weapon",
    "key": "weapon_66",
    "name": "천둥의 흔적",
    "aliases": [],
    "gameEntryId": 66
  },
  "title": "천둥의 흔적 — 잠재능력",
  "content": "천둥의 흔적 무기의 잠재능력은 마지막 옵션 ‘의료 · 탈로스의 눈’의 기본/최대 RANK를 올린다. 잠재 1는 RANK 1/4, 잠재 2는 RANK 2/5, 잠재 3는 RANK 3/6, 잠재 4는 RANK 4/7, 잠재 5는 RANK 5/8, 잠재 6는 RANK 6/9.",
  "facts": {
    "traitRef": "epwiki.ko-kr.weapon.66.option-3",
    "stages": [
      {
        "stage": 1,
        "baseRank": 1,
        "maxRank": 4,
        "effectRef": "epwiki.ko-kr.weapon.66.option-3#rank-1"
      },
      {
        "stage": 2,
        "baseRank": 2,
        "maxRank": 5,
        "effectRef": "epwiki.ko-kr.weapon.66.option-3#rank-2"
      },
      {
        "stage": 3,
        "baseRank": 3,
        "maxRank": 6,
        "effectRef": "epwiki.ko-kr.weapon.66.option-3#rank-3"
      },
      {
        "stage": 4,
        "baseRank": 4,
        "maxRank": 7,
        "effectRef": "epwiki.ko-kr.weapon.66.option-3#rank-4"
      },
      {
        "stage": 5,
        "baseRank": 5,
        "maxRank": 8,
        "effectRef": "epwiki.ko-kr.weapon.66.option-3#rank-5"
      },
      {
        "stage": 6,
        "baseRank": 6,
        "maxRank": 9,
        "effectRef": "epwiki.ko-kr.weapon.66.option-3#rank-6"
      }
    ]
  },
  "filters": {
    "entityType": "weapon",
    "documentType": "weapon_potential",
    "groupAxis": "weaponType",
    "groupCode": "greatsword",
    "groupLabel": "양손검"
  },
  "provenance": {
    "normalizedRef": "data/rag/normalized/ko-KR/weapon/양손검/66_천둥의_흔적.json",
    "sourceUrl": "https://wiki.skport.com/endfield/detail?mainTypeId=1&subTypeId=2&gameEntryId=66&header=0",
    "sourceSha256": "c5e440eeb33fc6187a094d8a24abf3ce734ebf85128a4f201267000b9aa134a9",
    "authority": "normalized_extraction",
    "verificationStatus": "rule_validated",
    "confidence": "medium",
    "evidenceDocumentIds": [
      "auto.weapon_66.potential.c4.chapter.s4.p0.ko-kr"
    ]
  },
  "coverage": {
    "withheldFields": []
  },
  "indexing": {
    "eligible": true,
    "vector": true,
    "keyword": true,
    "structured": true,
    "contentSha256": "93884a872c30aac5fa00481b88d0200da666d5d56a94d5f41202d5f57d76f473",
    "payloadSha256": "2f6989ee91877bb6bcc26f6c928d7929bab919e63331f29e56a1d816e0d34f6a"
  }
}
